{
  "comparison_group_id": "cmp-wildfire-response-seed-7",
  "completed": true,
  "evidence_completeness": 1.0,
  "evidence_threshold": 0.78,
  "final_belief": 0.83,
  "hard_constraint_violations": 0,
  "outcome_id": "outcome-run-wildfire-response-adaptive-seed-7",
  "policy": {
    "id": "wildfire-adaptive-v0",
    "kind": "adaptive",
    "version": "0.1.0"
  },
  "provenance": {
    "producer": "mission-studio-core",
    "producer_version": "0.1.0",
    "value_status": "derived"
  },
  "retained_rare_evidence": true,
  "run_id": "run-wildfire-response-adaptive-seed-7",
  "schema_version": "0.1.0",
  "summary": "Evidence threshold passed and selected evidence was downlinked.",
  "time_to_knowledge_s": 36,
  "transmitted_mb": 3.0,
  "utility_per_transmitted_mb": 0.276667
}
