{
  "schema_version": "0.1.0",
  "outcome_id": "outcome-run-la-fires-2025-worldmodel-ablation-myopic_bayes",
  "run_id": "run-la-fires-2025-worldmodel-ablation-myopic_bayes",
  "comparison_group_id": "cmp-la-fires-2025-worldmodel-ablation",
  "policy": {
    "id": "la-fires-myopic_bayes-v0",
    "kind": "fixed",
    "version": "0.1.0"
  },
  "completed": true,
  "final_belief": 0.9979,
  "evidence_threshold": 0.55,
  "time_to_knowledge_s": 1453248,
  "transmitted_mb": 0.65,
  "utility_per_transmitted_mb": 2.570308,
  "hard_constraint_violations": 0,
  "evidence_completeness": 0.6471,
  "retained_rare_evidence": false,
  "summary": "检出 11/17 块真实烧毁区域，误删率 35%，误报率 7%，平均延迟 16.82 天。",
  "provenance": {
    "producer": "orbital-triage",
    "producer_version": "0.1.0",
    "value_status": "derived"
  }
}