{
  "comparison_group_id": "cmp-maritime-sar-seed-7",
  "completed": false,
  "evidence_completeness": 1.0,
  "evidence_threshold": 0.76,
  "final_belief": 0.58,
  "hard_constraint_violations": 1,
  "outcome_id": "outcome-run-maritime-sar-fixed-seed-7",
  "policy": {
    "id": "maritime-fixed-v0",
    "kind": "fixed",
    "version": "0.1.0"
  },
  "provenance": {
    "producer": "mission-studio-core",
    "producer_version": "0.1.0",
    "value_status": "derived"
  },
  "retained_rare_evidence": false,
  "run_id": "run-maritime-sar-fixed-seed-7",
  "schema_version": "0.1.0",
  "summary": "Mission did not both pass the evidence threshold and downlink selected evidence.",
  "time_to_knowledge_s": null,
  "transmitted_mb": 8.0,
  "utility_per_transmitted_mb": 0.0725
}
